{
  "protocol_version": 1,
  "request_id": "aaaaaaaa-aaaa-4aaa-8aaa-aaaaaaaaaaa3",
  "device": {
    "device_id": "11111111-1111-4111-8111-111111111111",
    "boot_sequence": 42,
    "firmware_version": "2.0.0-cloud.1",
    "hardware_revision": "xiao-s3-r1",
    "telemetry_schema": 3,
    "config_schema": 7,
    "capability_hash": "yDT7H257uKE2R3D2Okc2g7PnDNGlvHnA2XzDv3AzfeA"
  },
  "clock": {
    "utc_ms": 1786641065000,
    "quality": "sntp_synced",
    "uncertainty_ms": 2500
  },
  "capabilities": null,
  "diagnostics": {
    "outbox_chunks": 1,
    "outbox_points": 3,
    "outbox_used_bytes": 96,
    "outbox_capacity_bytes": 1376256,
    "oldest_unacknowledged_utc_ms": 1786641000000,
    "dropped_points_total": 0,
    "last_error_code": null
  },
  "upload": {
    "chunks": [
      {
        "telemetry_schema": 3,
        "boot_sequence": 42,
        "chunk_sequence": 8,
        "first_point_sequence": 0,
        "point_count": 3,
        "time_quality": 4,
        "content_sha256": "_jihWuBz7CuQ7kZODIzPxZJZIgUGDhufAOdLFvZNFlc",
        "is_final": false,
        "points": [
          [468123456, -740123456, 1786641000, 125, 9, 7],
          [468123500, -740123400, 1786641005, 140, 9, 7],
          [468123500, -740123400, 1786641065, 0, 9, 13]
        ]
      }
    ],
    "summaries": [
      {
        "summary_id": "77777777-7777-4777-8777-777777777777",
        "local_date": "2026-08-13",
        "timezone": "America/Bogota",
        "source_revision": 1,
        "window_start": "2026-08-13T17:10:00.000Z",
        "window_end": "2026-08-13T17:11:05.000Z",
        "observed_s": 65,
        "moving_s": 5,
        "inactive_s": 60,
        "distance_m": 15,
        "max_speed_cmps": 140,
        "valid_points": 3,
        "gap_count": 0,
        "dropped_points": 0,
        "time_quality": "sntp_synced"
      }
    ],
    "loss_markers": []
  },
  "configuration": {
    "mutations": [
      {
        "mutation_id": "66666666-6666-4666-8666-666666666666",
        "local_sequence": 12,
        "resource_key": "brightness",
        "resource_schema": 1,
        "base_server_version": 17,
        "authored_hlc": {
          "physical_ms": 1786641000123,
          "logical": 0,
          "actor_id": "11111111-1111-4111-8111-111111111111"
        },
        "time_quality": "sntp_synced",
        "origin": "ap",
        "body": {"brightness": 96},
        "body_sha256": "qHIb69FUgaOyv3H4RMfHX8vtlwreJSvnUEiF6YMbFvk"
      }
    ],
    "reported": [
      {
        "resource_key": "brightness",
        "server_version": 16,
        "body_sha256": "e9Yh5fFte7QQ758BEPSGrpCV3Mar9BIln5mP7PcLhmo",
        "status": "applied",
        "error_code": null,
        "device_applied_at": "2026-08-13T17:00:00.000Z"
      }
    ]
  }
}
